reviewId	origReviewText	wordLexemList
304	Pretty flexible, solid camera with nice weight in the hand. Fits nicely in a cargo pant pocket or on my belt. Love the big, tilting viewing screen. Seems to be sharp with good color and I like being able to quickly choose among several ratio formats. I shoot mainly on manual, so I think the camera is a little sluggish when moving between settings and the * button on the back of the camera is badly placed. I constantly press this button by accident when making an adjustment and it changes my exposure settings to an unwanted default.	0:pretty:pretty:NN;1:flexible:flexible:JJ;2:solid:solid:JJ;3:camera:camera:NN;4:with:with:IN;5:nice:nice:JJ;6:weight:weight:NN;7:in:in:IN;8:the:the:DT;9:hand:hand:NN;10:fits:fit:VB;11:nicely:nicely:RB;12:in:in:IN;13:a:a:DT;14:cargo:cargo:NN;15:pant:pant:JJ;16:pocket:pocket:NN;17:or:or:CC;18:on:on:IN;19:my:my:PRP;20:belt:belt:NN;21:love:love:NN;22:the:the:DT;23:big:big:JJ;24:tilting:tilt:VB;25:viewing:view:VB;26:screen:screen:NN;27:seems:seem:VB;28:to:to:TO;29:be:be:VB;30:sharp:sharp:JJ;31:with:with:IN;32:good:good:JJ;33:color:color:NN;34:and:and:CC;35:i:i:PRP;36:like:like:VB;37:being:be:VB;38:able:able:JJ;39:to:to:TO;40:quickly:quickly:RB;41:choose:choose:VB;42:among:among:IN;43:several:several:JJ;44:ratio:ratio:NN;45:formats:format:NN;46:i:i:PRP;47:shoot:shoot:VB;48:mainly:mainly:RB;49:on:on:IN;50:manual:manual:NN;51:so:so:IN;52:i:i:PRP;53:think:think:VB;54:the:the:DT;55:camera:camera:NN;56:is:be:VB;57:a:a:DT;58:little:little:JJ;59:sluggish:sluggish:JJ;60:when:when:WRB;61:moving:move:VB;62:between:between:IN;63:settings:setting:NN;64:and:and:CC;65:the:the:DT;66:\*:\*:SYM;67:button:button:NN;68:on:on:IN;69:the:the:DT;70:back:back:NN;71:of:of:IN;72:the:the:DT;73:camera:camera:NN;74:is:be:VB;75:badly:badly:RB;76:placed:place:VB;77:i:i:PRP;78:constantly:constantly:RB;79:press:press:VB;80:this:this:DT;81:button:button:NN;82:by:by:IN;83:accident:accident:NN;84:when:when:WRB;85:making:make:VB;86:an:a:DT;87:adjustment:adjustment:NN;88:and:and:CC;89:it:it:PRP;90:changes:change:VB;91:my:my:PRP;92:exposure:exposure:NN;93:settings:setting:NN;94:to:to:TO;95:an:a:DT;96:unwanted:unwanted:JJ;97:default:default:NN;
305	Excellent conditions!! a very nice camera	0:excellent:excellent:JJ;1:conditions:condition:NN;2:a:a:DT;3:very:very:RB;4:nice:nice:JJ;5:camera:camera:NN;
306	I love this camera. If I want to, I can adjust it, but mostly I let it do its thing automatically. Great pictures, and the battery lasts a long time, too.	0:i:i:PRP;1:love:love:VB;2:this:this:DT;3:camera:camera:NN;4:if:if:IN;5:i:i:PRP;6:want:want:VB;7:to:to:TO;8:i:i:PRP;9:can:can:MD;10:adjust:adjust:VB;11:it:it:PRP;12:but:but:CC;13:mostly:mostly:RB;14:i:i:PRP;15:let:let:VB;16:it:it:PRP;17:do:do:VB;18:its:its:PRP;19:thing:thing:NN;20:automatically:automatically:RB;21:great:great:JJ;22:pictures:picture:NN;23:and:and:CC;24:the:the:DT;25:battery:battery:NN;26:lasts:last:VB;27:a:a:DT;28:long:long:JJ;29:time:time:NN;30:too:too:RB;
307	Excellent choice, works well very clear pictures	0:excellent:excellent:JJ;1:choice:choice:NN;2:works:work:VB;3:well:well:RB;4:very:very:RB;5:clear:clear:JJ;6:pictures:picture:NN;
308	its ok not easy to use and download , a smart phone is easier and cheaper	0:its:its:PRP;1:ok:ok:NN;2:not:not:RB;3:easy:easy:JJ;4:to:to:TO;5:use:use:VB;6:and:and:CC;7:download:download:VB;8:a:a:DT;9:smart:smart:JJ;10:phone:phone:NN;11:is:be:VB;12:easier:easier:JJ;13:and:and:CC;14:cheaper:cheaper:JJ;
309	Pretty trashy camera. Bought on a whim, for a school experiment. Its worse than most webcams.	0:pretty:pretty:NN;1:trashy:trashy:JJ;2:camera:camera:NN;3:bought:buy:VB;4:on:on:IN;5:a:a:DT;6:whim:whim:NN;7:for:for:IN;8:a:a:DT;9:school:school:NN;10:experiment:experiment:NN;11:its:its:PRP;12:worse:worse:JJ;13:than:than:IN;14:most:most:JJ;15:webcams:webcam:NN;
310	goo but does fair in 3d	0:goo:goo:NN;1:but:but:CC;2:does:do:VB;3:fair:fair:JJ;4:in:in:IN;5:3d:3d:NN;
311	very good camera for my 9 year old daughter!	0:very:very:RB;1:good:good:JJ;2:camera:camera:NN;3:for:for:IN;4:my:my:PRP;5:9:9:CD;6:year:year:NN;7:old:old:JJ;8:daughter:daughter:NN;
312	It's an amazing camera for the price of it.	0:it:it:PRP;1:'s:be:VB;2:an:a:DT;3:amazing:amazing:JJ;4:camera:camera:NN;5:for:for:IN;6:the:the:DT;7:price:price:NN;8:of:of:IN;9:it:it:PRP;
313	Bought 2 cameras in Feb 2014 and in July 2014 they both quit working.  They would not turn on anymore.  Sent them back to Casio to see about getting them repaired and they said it will cost $150 for each camera to fix.  We did not misuse these cameras,  they just stopped working one day.  Pretty crappy item if they quit working for no apparent reason and then Casio wants to charge to fix their defective equipment.	0:bought:buy:VB;1:2:2:CD;2:cameras:camera:NN;3:in:in:IN;4:feb:feb:NN;5:2014:2014:CD;6:and:and:CC;7:in:in:IN;8:july:july:NN;9:2014:2014:CD;10:they:they:PRP;11:both:both:DT;12:quit:quit:VB;13:working:work:VB;14:they:they:PRP;15:would:would:MD;16:not:not:RB;17:turn:turn:VB;18:on:on:RP;19:anymore:anymore:RB;20:sent:send:VB;21:them:they:PRP;22:back:back:RB;23:to:to:TO;24:casio:casio:NN;25:to:to:TO;26:see:see:VB;27:about:about:IN;28:getting:get:VB;29:them:they:PRP;30:repaired:repair:VB;31:and:and:CC;32:they:they:PRP;33:said:say:VB;34:it:it:PRP;35:will:will:MD;36:cost:cost:VB;37:150:150:CD;38:for:for:IN;39:each:each:DT;40:camera:camera:NN;41:to:to:TO;42:fix:fix:VB;43:we:we:PRP;44:did:do:VB;45:not:not:RB;46:misuse:misuse:NN;47:these:these:DT;48:cameras:camera:NN;49:they:they:PRP;50:just:just:RB;51:stopped:stop:VB;52:working:work:VB;53:one:one:CD;54:day:day:NN;55:pretty:pretty:NN;56:crappy:crappy:JJ;57:item:item:NN;58:if:if:IN;59:they:they:PRP;60:quit:quit:VB;61:working:work:VB;62:for:for:IN;63:no:no:DT;64:apparent:apparent:JJ;65:reason:reason:NN;66:and:and:CC;67:then:then:RB;68:casio:casio:NN;69:wants:want:VB;70:to:to:TO;71:charge:charge:VB;72:to:to:TO;73:fix:fix:VB;74:their:they:PRP;75:defective:defective:JJ;76:equipment:equipment:NN;
314	Shopping for an upgrade, I saw the unhappy reviews here about this camera's durability.  I've had the opposite experience, so felt I should give another view point. Bought my camera back in early 2010.  I've taken it to all kinds of places, in my jeans pocket, no case.. It's been in my pocket when it poured down rain, worked fine. Dropped it, more than a few times, no issues. It's been stolen by a cat as a toy, and dragged under furniture, no damage.  Taken 1000's of pictures, zooming in and out.  Made in China. Camera buttons and lens all still work flawlessly, and look great.  Crawled around in dusty, and fur filled areas, while holding the camera. Pictures don't have any dark spots from any particles in the lens.. No, I've not cleaned the camera, other than to wipe the LCD screen on my shirt.  Only deducting one star because I feel irritated about having to buy another camera only 4 years later, to get better pictures. Honestly, that's not really the camera's fault.. My only issue is I started taking pictures of small moving animals in low light conditions, and need something a bit more detailed. (If you can't tell from that prior sentence, I'm strictly an ordinary point and shoot user.)  Not entirely certain what I want is even being made though.. This camera had the easiest to operate, with one hand, on/off button I've seen.  The Elph 330 seems like the best upgrade, camera-wise, due to the 340 being less of a camera than the 330, annoyingly.  Unfortunately I got spoiled with this color option, and was hoping for another blue, preferably darker. Considering I don't think they have made an upgrade that is 100% an upgrade (on/off button, etc.), this camera probably deserves a 5 star rating.	0:shopping:shopping:NN;1:for:for:IN;2:an:a:DT;3:upgrade:upgrade:NN;4:i:i:PRP;5:saw:see:VB;6:the:the:DT;7:unhappy:unhappy:JJ;8:reviews:review:NN;9:here:here:RB;10:about:about:IN;11:this:this:DT;12:camera:camera:NN;13:'s:'s:POS;14:durability:durability:NN;15:i:i:PRP;16:'ve:have:VB;17:had:have:VB;18:the:the:DT;19:opposite:opposite:JJ;20:experience:experience:NN;21:so:so:RB;22:felt:feel:VB;23:i:i:PRP;24:should:should:MD;25:give:give:VB;26:another:another:DT;27:view:view:NN;28:point:point:NN;29:bought:bought:JJ;30:my:my:PRP;31:camera:camera:NN;32:back:back:RB;33:in:in:IN;34:early:early:JJ;35:2010:2010:CD;36:i:i:PRP;37:'ve:have:VB;38:taken:take:VB;39:it:it:PRP;40:to:to:TO;41:all:all:DT;42:kinds:kind:NN;43:of:of:IN;44:places:place:NN;45:in:in:IN;46:my:my:PRP;47:jeans:jeans:NN;48:pocket:pocket:NN;49:no:no:DT;50:case:case:NN;51:it:it:PRP;52:'s:be:VB;53:been:be:VB;54:in:in:IN;55:my:my:PRP;56:pocket:pocket:NN;57:when:when:WRB;58:it:it:PRP;59:poured:pour:VB;60:down:down:RP;61:rain:rain:NN;62:worked:work:VB;63:fine:fine:NN;64:dropped:drop:VB;65:it:it:PRP;66:more:more:JJ;67:than:than:IN;68:a:a:DT;69:few:few:JJ;70:times:time:NN;71:no:no:DT;72:issues:issue:NN;73:it:it:PRP;74:'s:be:VB;75:been:be:VB;76:stolen:steal:VB;77:by:by:IN;78:a:a:DT;79:cat:cat:NN;80:as:as:IN;81:a:a:DT;82:toy:toy:NN;83:and:and:CC;84:dragged:drag:VB;85:under:under:IN;86:furniture:furniture:NN;87:no:no:DT;88:damage:damage:NN;89:taken:take:VB;90:1000:1000:CD;91:'s:'s:POS;92:of:of:IN;93:pictures:picture:NN;94:zooming:zoom:VB;95:in:in:IN;96:and:and:CC;97:out:out:IN;98:made:make:VB;99:in:in:IN;100:china:china:NN;101:camera:camera:NN;102:buttons:button:NN;103:and:and:CC;104:lens:lens:NN;105:all:all:DT;106:still:still:RB;107:work:work:NN;108:flawlessly:flawlessly:RB;109:and:and:CC;110:look:look:VB;111:great:great:JJ;112:crawled:crawl:VB;113:around:around:IN;114:in:in:IN;115:dusty:dusty:JJ;116:and:and:CC;117:fur:fur:NN;118:filled:fill:VB;119:areas:area:NN;120:while:while:IN;121:holding:hold:VB;122:the:the:DT;123:camera:camera:NN;124:pictures:picture:NN;125:do:do:VB;126:n't:not:RB;127:have:have:VB;128:any:any:DT;129:dark:dark:JJ;130:spots:spot:NN;131:from:from:IN;132:any:any:DT;133:particles:particle:NN;134:in:in:IN;135:the:the:DT;136:lens:lens:NN;137:no:no:DT;138:i:i:PRP;139:'ve:have:VB;140:not:not:RB;141:cleaned:clean:VB;142:the:the:DT;143:camera:camera:NN;144:other:other:JJ;145:than:than:IN;146:to:to:TO;147:wipe:wipe:VB;148:the:the:DT;149:lcd:lcd:NN;150:screen:screen:NN;151:on:on:IN;152:my:my:PRP;153:shirt:shirt:NN;154:only:only:RB;155:deducting:deduct:VB;156:one:one:CD;157:star:star:NN;158:because:because:IN;159:i:i:PRP;160:feel:feel:VB;161:irritated:irritated:JJ;162:about:about:IN;163:having:have:VB;164:to:to:TO;165:buy:buy:VB;166:another:another:DT;167:camera:camera:NN;168:only:only:RB;169:4:4:CD;170:years:year:NN;171:later:later:RB;172:to:to:TO;173:get:get:VB;174:better:better:JJ;175:pictures:picture:NN;176:honestly:honestly:RB;177:that:that:DT;178:'s:be:VB;179:not:not:RB;180:really:really:RB;181:the:the:DT;182:camera:camera:NN;183:'s:'s:POS;184:fault:fault:NN;185:my:my:PRP;186:only:only:JJ;187:issue:issue:NN;188:is:be:VB;189:i:i:PRP;190:started:start:VB;191:taking:take:VB;192:pictures:picture:NN;193:of:of:IN;194:small:small:JJ;195:moving:move:VB;196:animals:animal:NN;197:in:in:IN;198:low:low:JJ;199:light:light:JJ;200:conditions:condition:NN;201:and:and:CC;202:need:need:VB;203:something:something:NN;204:a:a:DT;205:bit:bit:NN;206:more:more:RB;207:detailed:detailed:JJ;208:if:if:IN;209:you:you:PRP;210:ca:can:MD;211:n't:not:RB;212:tell:tell:VB;213:from:from:IN;214:that:that:DT;215:prior:prior:JJ;216:sentence:sentence:NN;217:i:i:PRP;218:'m:be:VB;219:strictly:strictly:RB;220:an:a:DT;221:ordinary:ordinary:JJ;222:point:point:NN;223:and:and:CC;224:shoot:shoot:VB;225:user:user:NN;226:not:not:RB;227:entirely:entirely:RB;228:certain:certain:JJ;229:what:what:WP;230:i:i:PRP;231:want:want:VB;232:is:be:VB;233:even:even:RB;234:being:be:VB;235:made:make:VB;236:though:though:IN;237:this:this:DT;238:camera:camera:NN;239:had:have:VB;240:the:the:DT;241:easiest:easiest:JJ;242:to:to:TO;243:operate:operate:VB;244:with:with:IN;245:one:one:CD;246:hand:hand:NN;247:on:on:IN;248:off:off:RP;249:button:button:NN;250:i:i:PRP;251:'ve:have:VB;252:seen:see:VB;253:the:the:DT;254:elph:elph:NN;255:330:330:CD;256:seems:seem:VB;257:like:like:IN;258:the:the:DT;259:best:best:JJ;260:upgrade:upgrade:NN;261:camera:camera:NN;262:wise:wise:JJ;263:due:due:JJ;264:to:to:TO;265:the:the:DT;266:340:340:CD;267:being:be:VB;268:less:less:JJ;269:of:of:IN;270:a:a:DT;271:camera:camera:NN;272:than:than:IN;273:the:the:DT;274:330:330:CD;275:annoyingly:annoyingly:RB;276:unfortunately:unfortunately:RB;277:i:i:PRP;278:got:get:VB;279:spoiled:spoil:VB;280:with:with:IN;281:this:this:DT;282:color:color:NN;283:option:option:NN;284:and:and:CC;285:was:be:VB;286:hoping:hope:VB;287:for:for:IN;288:another:another:DT;289:blue:blue:JJ;290:preferably:preferably:RB;291:darker:darker:JJ;292:considering:consider:VB;293:i:i:PRP;294:do:do:VB;295:n't:not:RB;296:think:think:VB;297:they:they:PRP;298:have:have:VB;299:made:make:VB;300:an:a:DT;301:upgrade:upgrade:NN;302:that:that:WDT;303:is:be:VB;304:100:100:CD;305:%:%:NN;306:an:a:DT;307:upgrade:upgrade:NN;308:on:on:IN;309:off:off:RP;310:button:button:NN;311:etc.:etc.:NN;312:this:this:DT;313:camera:camera:NN;314:probably:probably:RB;315:deserves:deserve:VB;316:a:a:DT;317:5:5:CD;318:star:star:NN;319:rating:rating:NN;
315	Great price and swift response to replace my identical camera that I broke. Yay for reusing old equipment!	0:great:great:JJ;1:price:price:NN;2:and:and:CC;3:swift:swift:JJ;4:response:response:NN;5:to:to:TO;6:replace:replace:VB;7:my:my:PRP;8:identical:identical:JJ;9:camera:camera:NN;10:that:that:IN;11:i:i:PRP;12:broke:break:VB;13:yay:yay:NN;14:for:for:IN;15:reusing:reuse:VB;16:old:old:JJ;17:equipment:equipment:NN;
316	Can't go wrong with Canon.  And if you drop it or break it, they have a plan where you can send it back in and for a discounted amount, they'll send you a brand new one!	0:ca:can:MD;1:n't:not:RB;2:go:go:VB;3:wrong:wrong:JJ;4:with:with:IN;5:canon:canon:NN;6:and:and:CC;7:if:if:IN;8:you:you:PRP;9:drop:drop:VB;10:it:it:PRP;11:or:or:CC;12:break:break:VB;13:it:it:PRP;14:they:they:PRP;15:have:have:VB;16:a:a:DT;17:plan:plan:NN;18:where:where:WRB;19:you:you:PRP;20:can:can:MD;21:send:send:VB;22:it:it:PRP;23:back:back:RB;24:in:in:IN;25:and:and:CC;26:for:for:IN;27:a:a:DT;28:discounted:discounted:JJ;29:amount:amount:NN;30:they:they:PRP;31:'ll:'ll:MD;32:send:send:VB;33:you:you:PRP;34:a:a:DT;35:brand:brand:NN;36:new:new:JJ;37:one:one:CD;
317	Good product and service	0:good:good:JJ;1:product:product:NN;2:and:and:CC;3:service:service:NN;
318	takes great pictures trust that	0:takes:take:VB;1:great:great:JJ;2:pictures:picture:NN;3:trust:trust:NN;4:that:that:WDT;
319	Camera is in better condition than I expected.  Everything works	0:camera:camera:NN;1:is:be:VB;2:in:in:IN;3:better:better:JJ;4:condition:condition:NN;5:than:than:IN;6:i:i:PRP;7:expected:expect:VB;8:everything:everything:NN;9:works:work:VB;
320	this is a great camera, video is wonderful, big screen, and my girls love them, also if you are looking for a GREAT FREE Video dowloader, go here	0:this:this:DT;1:is:be:VB;2:a:a:DT;3:great:great:JJ;4:camera:camera:NN;5:video:video:NN;6:is:be:VB;7:wonderful:wonderful:JJ;8:big:big:JJ;9:screen:screen:NN;10:and:and:CC;11:my:my:PRP;12:girls:girl:NN;13:love:love:VB;14:them:they:PRP;15:also:also:RB;16:if:if:IN;17:you:you:PRP;18:are:be:VB;19:looking:look:VB;20:for:for:IN;21:a:a:DT;22:great:great:JJ;23:free:free:NN;24:video:video:NN;25:dowloader:dowloader:NN;26:go:go:VB;27:here:here:RB;
321	I use this camera to film the led displays I sell.. Great work tool.	0:i:i:PRP;1:use:use:VB;2:this:this:DT;3:camera:camera:NN;4:to:to:TO;5:film:film:NN;6:the:the:DT;7:led:lead:VB;8:displays:display:NN;9:i:i:PRP;10:sell:sell:VB;11:great:great:JJ;12:work:work:NN;13:tool:tool:NN;
322	I really like this camera.  It has sharp pictures with up to 56x magnification (have often used it as binoculars) and is fairly rugged (have dropped it on several occasions).  This is my second Canon PowerShot SX210 (had to replace my first after dropping it into a pond).	0:i:i:PRP;1:really:really:RB;2:like:like:IN;3:this:this:DT;4:camera:camera:NN;5:it:it:PRP;6:has:have:VB;7:sharp:sharp:JJ;8:pictures:picture:NN;9:with:with:IN;10:up:up:RB;11:to:to:TO;12:56x:56x:NN;13:magnification:magnification:NN;14:have:have:VB;15:often:often:RB;16:used:use:VB;17:it:it:PRP;18:as:as:IN;19:binoculars:binoculars:NN;20:and:and:CC;21:is:be:VB;22:fairly:fairly:RB;23:rugged:rugged:JJ;24:have:have:VB;25:dropped:drop:VB;26:it:it:PRP;27:on:on:IN;28:several:several:JJ;29:occasions:occasion:NN;30:this:this:DT;31:is:be:VB;32:my:my:PRP;33:second:second:JJ;34:canon:canon:NN;35:powershot:powershot:NN;36:sx210:sx210:NN;37:had:have:VB;38:to:to:TO;39:replace:replace:VB;40:my:my:PRP;41:first:first:JJ;42:after:after:IN;43:dropping:drop:VB;44:it:it:PRP;45:into:into:IN;46:a:a:DT;47:pond:pond:NN;
323	Best little camera ever	0:best:best:JJ;1:little:little:JJ;2:camera:camera:NN;3:ever:ever:RB;
324	I love this camera! It looks great and works great!	0:i:i:PRP;1:love:love:VB;2:this:this:DT;3:camera:camera:NN;4:it:it:PRP;5:looks:look:VB;6:great:great:JJ;7:and:and:CC;8:works:work:VB;9:great:great:JJ;
325	have had this camera for years now and the main complaint i have about it is the non adjustable focus for it.  but.  for the price you and ease of use for beginner photography it was an overall good buy	0:have:have:VB;1:had:have:VB;2:this:this:DT;3:camera:camera:NN;4:for:for:IN;5:years:year:NN;6:now:now:RB;7:and:and:CC;8:the:the:DT;9:main:main:JJ;10:complaint:complaint:NN;11:i:i:FW;12:have:have:VB;13:about:about:IN;14:it:it:PRP;15:is:be:VB;16:the:the:DT;17:non:non:JJ;18:adjustable:adjustable:JJ;19:focus:focus:NN;20:for:for:IN;21:it:it:PRP;22:but:but:CC;23:for:for:IN;24:the:the:DT;25:price:price:NN;26:you:you:PRP;27:and:and:CC;28:ease:ease:NN;29:of:of:IN;30:use:use:NN;31:for:for:IN;32:beginner:beginner:NN;33:photography:photography:NN;34:it:it:PRP;35:was:be:VB;36:an:a:DT;37:overall:overall:JJ;38:good:good:JJ;39:buy:buy:NN;
326	Really good camera for the price.  Easy to use.	0:really:really:RB;1:good:good:JJ;2:camera:camera:NN;3:for:for:IN;4:the:the:DT;5:price:price:NN;6:easy:easy:NN;7:to:to:TO;8:use:use:VB;
327	Works as it should	0:works:works:NN;1:as:as:IN;2:it:it:PRP;3:should:should:MD;
328	You get what you pay for.  Bad camera.	0:you:you:PRP;1:get:get:VB;2:what:what:WP;3:you:you:PRP;4:pay:pay:VB;5:for:for:IN;6:bad:bad:JJ;7:camera:camera:NN;
329	auto focus on mine is broke i have to shut it off and turn it back on untill the focus works	0:auto:auto:NN;1:focus:focus:NN;2:on:on:IN;3:mine:mine:NN;4:is:be:VB;5:broke:break:VB;6:i:i:FW;7:have:have:VB;8:to:to:TO;9:shut:shut:VB;10:it:it:PRP;11:off:off:RP;12:and:and:CC;13:turn:turn:VB;14:it:it:PRP;15:back:back:RB;16:on:on:IN;17:untill:untill:NN;18:the:the:DT;19:focus:focus:NN;20:works:work:VB;
330	I took this camera to france and as i was taking photos, some guy on a moped decides to snatch it out of my hand. never going to france again lol. Great camera. 10/10 would take photos with it again	0:i:i:PRP;1:took:take:VB;2:this:this:DT;3:camera:camera:NN;4:to:to:TO;5:france:france:NN;6:and:and:CC;7:as:as:IN;8:i:i:FW;9:was:be:VB;10:taking:take:VB;11:photos:photo:NN;12:some:some:DT;13:guy:guy:NN;14:on:on:IN;15:a:a:DT;16:moped:moped:JJ;17:decides:decide:VB;18:to:to:TO;19:snatch:snatch:VB;20:it:it:PRP;21:out:out:IN;22:of:of:IN;23:my:my:PRP;24:hand:hand:NN;25:never:never:RB;26:going:go:VB;27:to:to:TO;28:france:france:VB;29:again:again:RB;30:lol:lol:RB;31:great:great:JJ;32:camera:camera:NN;33:10:10:CD;34:10:10:CD;35:would:would:MD;36:take:take:VB;37:photos:photo:NN;38:with:with:IN;39:it:it:PRP;40:again:again:RB;
331	This camera is great for me.  I have benign familial trembling and this camera freezes the pic and gives me a great picture when other cameras gave me fuzzie pictures because of my tremors.	0:this:this:DT;1:camera:camera:NN;2:is:be:VB;3:great:great:JJ;4:for:for:IN;5:me:i:PRP;6:i:i:PRP;7:have:have:VB;8:benign:benign:JJ;9:familial:familial:JJ;10:trembling:tremble:VB;11:and:and:CC;12:this:this:DT;13:camera:camera:NN;14:freezes:freeze:VB;15:the:the:DT;16:pic:pic:NN;17:and:and:CC;18:gives:give:VB;19:me:i:PRP;20:a:a:DT;21:great:great:JJ;22:picture:picture:NN;23:when:when:WRB;24:other:other:JJ;25:cameras:camera:NN;26:gave:give:VB;27:me:i:PRP;28:fuzzie:fuzzie:JJ;29:pictures:picture:NN;30:because:because:IN;31:of:of:IN;32:my:my:PRP;33:tremors:tremor:NN;
332	Great camera.  Works as advertised.  Arrived on schedule.	0:great:great:JJ;1:camera:camera:NN;2:works:works:NN;3:as:as:IN;4:advertised:advertise:VB;5:arrived:arrive:VB;6:on:on:IN;7:schedule:schedule:NN;
333	my wife loved it	0:my:my:PRP;1:wife:wife:NN;2:loved:love:VB;3:it:it:PRP;
334	This is a great little point and shoot.  I have been looking for a second camera to use for photographing very realistic dolls I paint and sell.  I'd been using a Coolpix S4000, and had good results, but thought I'd try another Nikon with 20MP.  It was horrible- all photos were blurred, so I sent it back within 24 hours of getting it.. I came back to the S4000, and don't regret it at all.  I got a different color from my first, to tell them apart (personal photos vs. photos for selling the dolls).  There are many different settings for outdoors, portraits, macro, landscape, etc.  I keep both of them set on auto flash, and the doll camera is kept on Macro most of the time, for close ups on fingernails and eyes- when I crop them, they don't lose sharpness.  I've used the auto-timer with great success when I want to be in a photo (family shots).  I did a LOT of 35mm SLR photography in the past, and while I still enjoy those photographs, the photos from this is definitely adequate for my needs- whether family photos, outdoor photos, to take to museums, etc.. Bottom line:  It is a good enough camera to have gotten another one, 3 years after getting the first.	0:this:this:DT;1:is:be:VB;2:a:a:DT;3:great:great:JJ;4:little:little:JJ;5:point:point:NN;6:and:and:CC;7:shoot:shoot:NN;8:i:i:PRP;9:have:have:VB;10:been:be:VB;11:looking:look:VB;12:for:for:IN;13:a:a:DT;14:second:second:JJ;15:camera:camera:NN;16:to:to:TO;17:use:use:VB;18:for:for:IN;19:photographing:photograph:VB;20:very:very:RB;21:realistic:realistic:JJ;22:dolls:doll:NN;23:i:i:PRP;24:paint:paint:VB;25:and:and:CC;26:sell:sell:VB;27:i:i:PRP;28:'d:would:MD;29:been:be:VB;30:using:use:VB;31:a:a:DT;32:coolpix:coolpix:NN;33:s4000:s4000:NN;34:and:and:CC;35:had:have:VB;36:good:good:JJ;37:results:result:NN;38:but:but:CC;39:thought:think:VB;40:i:i:PRP;41:'d:would:MD;42:try:try:VB;43:another:another:DT;44:nikon:nikon:NN;45:with:with:IN;46:20mp:20mp:NN;47:it:it:PRP;48:was:be:VB;49:horrible:horrible:JJ;50:all:all:DT;51:photos:photo:NN;52:were:be:VB;53:blurred:blur:VB;54:so:so:IN;55:i:i:PRP;56:sent:send:VB;57:it:it:PRP;58:back:back:RB;59:within:within:IN;60:24:24:CD;61:hours:hour:NN;62:of:of:IN;63:getting:get:VB;64:it:it:PRP;65:i:i:PRP;66:came:come:VB;67:back:back:RB;68:to:to:TO;69:the:the:DT;70:s4000:s4000:NN;71:and:and:CC;72:do:do:VB;73:n't:not:RB;74:regret:regret:VB;75:it:it:PRP;76:at:at:IN;77:all:all:DT;78:i:i:PRP;79:got:get:VB;80:a:a:DT;81:different:different:JJ;82:color:color:NN;83:from:from:IN;84:my:my:PRP;85:first:first:JJ;86:to:to:TO;87:tell:tell:VB;88:them:they:PRP;89:apart:apart:RB;90:personal:personal:JJ;91:photos:photo:NN;92:vs.:vs.:CC;93:photos:photo:NN;94:for:for:IN;95:selling:sell:VB;96:the:the:DT;97:dolls:doll:NN;98:there:there:EX;99:are:be:VB;100:many:many:JJ;101:different:different:JJ;102:settings:setting:NN;103:for:for:IN;104:outdoors:outdoors:NN;105:portraits:portrait:NN;106:macro:macro:NN;107:landscape:landscape:NN;108:etc.:etc.:FW;109:i:i:PRP;110:keep:keep:VB;111:both:both:DT;112:of:of:IN;113:them:they:PRP;114:set:set:VB;115:on:on:IN;116:auto:auto:NN;117:flash:flash:NN;118:and:and:CC;119:the:the:DT;120:doll:doll:NN;121:camera:camera:NN;122:is:be:VB;123:kept:keep:VB;124:on:on:IN;125:macro:macro:NN;126:most:most:JJ;127:of:of:IN;128:the:the:DT;129:time:time:NN;130:for:for:IN;131:close:close:JJ;132:ups:up:NN;133:on:on:IN;134:fingernails:fingernail:NN;135:and:and:CC;136:eyes:eye:NN;137:when:when:WRB;138:i:i:PRP;139:crop:crop:VB;140:them:they:PRP;141:they:they:PRP;142:do:do:VB;143:n't:not:RB;144:lose:lose:VB;145:sharpness:sharpness:NN;146:i:i:PRP;147:'ve:have:VB;148:used:use:VB;149:the:the:DT;150:auto:auto:NN;151:timer:timer:NN;152:with:with:IN;153:great:great:JJ;154:success:success:NN;155:when:when:WRB;156:i:i:PRP;157:want:want:VB;158:to:to:TO;159:be:be:VB;160:in:in:IN;161:a:a:DT;162:photo:photo:NN;163:family:family:NN;164:shots:shot:NN;165:i:i:PRP;166:did:do:VB;167:a:a:DT;168:lot:lot:NN;169:of:of:IN;170:35mm:35mm:CD;171:slr:slr:NN;172:photography:photography:NN;173:in:in:IN;174:the:the:DT;175:past:past:NN;176:and:and:CC;177:while:while:IN;178:i:i:PRP;179:still:still:RB;180:enjoy:enjoy:VB;181:those:those:DT;182:photographs:photograph:NN;183:the:the:DT;184:photos:photo:NN;185:from:from:IN;186:this:this:DT;187:is:be:VB;188:definitely:definitely:RB;189:adequate:adequate:JJ;190:for:for:IN;191:my:my:PRP;192:needs:need:NN;193:whether:whether:IN;194:family:family:NN;195:photos:photo:NN;196:outdoor:outdoor:JJ;197:photos:photo:NN;198:to:to:TO;199:take:take:VB;200:to:to:TO;201:museums:museum:NN;202:etc.:etc.:FW;203:bottom:bottom:NN;204:line:line:NN;205:it:it:PRP;206:is:be:VB;207:a:a:DT;208:good:good:JJ;209:enough:enough:JJ;210:camera:camera:NN;211:to:to:TO;212:have:have:VB;213:gotten:get:VB;214:another:another:DT;215:one:one:CD;216:3:3:CD;217:years:year:NN;218:after:after:IN;219:getting:get:VB;220:the:the:DT;221:first:first:JJ;
335	Camera worked for two weeks and quit. I plan to return it when I return to US.	0:camera:camera:NN;1:worked:work:VB;2:for:for:IN;3:two:two:CD;4:weeks:week:NN;5:and:and:CC;6:quit:quit:VB;7:i:i:PRP;8:plan:plan:VB;9:to:to:TO;10:return:return:VB;11:it:it:PRP;12:when:when:WRB;13:i:i:PRP;14:return:return:VB;15:to:to:TO;16:us:us:NN;
