912	very handy	387	very handy for snorkeling takes
913	daughter loved	138	to my wife her daughter loved it too so
914	fix	313	for each camera to fix we did not
915	much better photos	415	kids cameras & takes much better photos after some practice
916	bulky	347	this camera is bulky and the picture
917	sutter wo n't close	118	at first then the sutter wo n't close after 3-4 year
918	works like brand new	166	now and it still works like brand new everyone raves about
919	reasonably priced	414	excellent good purchase reasonably priced
920	badly placed	304	of the camera is badly placed i constantly press
921	best point and shoot	159	series camera ever made best point and shoot camera ever made
922	trashy camera	309	pretty trashy camera bought on a
923	easy downloading	457	it also allows for easy downloading onto a computer
924	error	123	did get one lens error message but nothing
925	extremely waterproof	339	extremely waterproof and rugged looks
926	clearance	136	at wal mart on clearance for 20 had
927	good color	304	to be sharp with good color and i like
928	battery always lasted	183	perfect working order the battery always lasted me all day
929	vista	261	is only supported by vista or older
930	summer	408	about 4 times a summer the rest of
931	negative	209	great camera the only negative comment i have
